{
  "$schema": "./registration-measurements.schema.json",
  "schemaVersion": 1,
  "release": "v01.01",
  "phase": "F0.2",
  "masterId": "mara-v5-cutout-candidate",
  "sourcePath": "docs/art/pilot/mara_v5_cutout.png",
  "measuredAt": "2026-07-10",
  "coordinateSpace": "source_canvas_pixels",
  "imageMeasurement": {
    "canvas": { "width": 1254, "height": 1254 },
    "alphaThreshold": 128,
    "opaquePixels": 254437,
    "figureBounds": { "x": 362, "y": 170, "width": 538, "height": 838, "maxX": 899, "maxY": 1007 },
    "feetBaselineY": 1007,
    "widestOpaqueRowY": 420
  },
  "authoringAnchors": {
    "headPivot": { "x": 628, "y": 465, "semantic": "face_center_excluding_hair" },
    "chestSocket": { "x": 628, "y": 648, "semantic": "upper_garment_center" },
    "leftHandSocket": { "x": 752, "y": 790, "semantic": "character_left_hand_screen_right" },
    "rightHandSocket": { "x": 527, "y": 717, "semantic": "character_right_hand_screen_left" }
  },
  "status": "measured_pending_composite_proof",
  "proofRequired": [
    "Use this exact source canvas without scaling or recropping.",
    "Confirm one garment mask, one hair pair, and one expression composite without seams at 96, 128, and 256 px.",
    "Do not move an anchor after the first composed-pilot approval; create a new registration master instead."
  ]
}
